{
  "code": "ORCL",
  "name": "Oracle Corporation",
  "market": "US",
  "as_of": "2026-07-21T16:13:41.956826+00:00",
  "source": "edgar",
  "growth": {
    "latest_year": "2026",
    "value": 17.35,
    "cagr_pct": 10.48,
    "judgment": "good",
    "series": [
      {
        "year": "2022",
        "value": 42440000000
      },
      {
        "year": "2023",
        "value": 49954000000
      },
      {
        "year": "2024",
        "value": 52961000000
      },
      {
        "year": "2025",
        "value": 57399000000
      },
      {
        "year": "2026",
        "value": 67357000000
      }
    ]
  },
  "profitability": {
    "latest_year": "2026",
    "value": 30.59,
    "own_5y_avg": 33.65,
    "judgment": "caution",
    "series": [
      {
        "year": "2022",
        "value": 25.74
      },
      {
        "year": "2023",
        "value": 26.21
      },
      {
        "year": "2024",
        "value": 28.99
      },
      {
        "year": "2025",
        "value": 30.8
      },
      {
        "year": "2026",
        "value": 30.59
      }
    ]
  },
  "stability": null,
  "cashflow": {
    "latest_year": "2026",
    "value": -23686000000,
    "judgment": "caution",
    "series": [
      {
        "year": "2017",
        "value": 12105000000
      },
      {
        "year": "2018",
        "value": 13650000000
      },
      {
        "year": "2019",
        "value": 12891000000
      },
      {
        "year": "2020",
        "value": 11575000000
      },
      {
        "year": "2021",
        "value": 13752000000
      },
      {
        "year": "2022",
        "value": 5028000000
      },
      {
        "year": "2023",
        "value": 8470000000
      },
      {
        "year": "2024",
        "value": 11807000000
      },
      {
        "year": "2025",
        "value": -394000000
      },
      {
        "year": "2026",
        "value": -23686000000
      }
    ]
  },
  "valuation": {
    "latest_year": "2026",
    "eps": 5.83,
    "per": 21.49,
    "note": null
  }
}