{
  "code": "DHR",
  "name": "Danaher Corporation",
  "market": "US",
  "as_of": "2026-07-21T16:13:33.216295+00:00",
  "source": "edgar",
  "growth": {
    "latest_year": "2025",
    "value": 2.9,
    "cagr_pct": -2.67,
    "judgment": "good",
    "series": [
      {
        "year": "2021",
        "value": 24802000000
      },
      {
        "year": "2022",
        "value": 26643000000
      },
      {
        "year": "2023",
        "value": 23890000000
      },
      {
        "year": "2024",
        "value": 23875000000
      },
      {
        "year": "2025",
        "value": 24568000000
      }
    ]
  },
  "profitability": {
    "latest_year": "2025",
    "value": 19.09,
    "own_5y_avg": 20.77,
    "judgment": "caution",
    "series": [
      {
        "year": "2021",
        "value": 25.71
      },
      {
        "year": "2022",
        "value": 28.29
      },
      {
        "year": "2023",
        "value": 21.77
      },
      {
        "year": "2024",
        "value": 20.37
      },
      {
        "year": "2025",
        "value": 19.09
      }
    ]
  },
  "stability": {
    "latest_year": "2010",
    "value": 61.59,
    "judgment": "good",
    "series": [
      {
        "year": "2008",
        "value": 78.32
      },
      {
        "year": "2009",
        "value": 68.49
      },
      {
        "year": "2010",
        "value": 61.59
      }
    ]
  },
  "cashflow": {
    "latest_year": "2025",
    "value": 5260000000,
    "judgment": "good",
    "series": [
      {
        "year": "2016",
        "value": 2932200000
      },
      {
        "year": "2017",
        "value": 2907100000
      },
      {
        "year": "2018",
        "value": 3438000000
      },
      {
        "year": "2019",
        "value": 3316000000
      },
      {
        "year": "2020",
        "value": 5417000000
      },
      {
        "year": "2021",
        "value": 7118000000
      },
      {
        "year": "2022",
        "value": 7401000000
      },
      {
        "year": "2023",
        "value": 5781000000
      },
      {
        "year": "2024",
        "value": 5296000000
      },
      {
        "year": "2025",
        "value": 5260000000
      }
    ]
  },
  "valuation": null
}